{
  "$schema": "./roster.schema.json",
  "version": "1.1.0",
  "description": "Authoritative LazySitter roster. Single source of truth for both the Claude Code and Codex adapters. The installer derives per-tool output from this file plus core/agents/*.md. Do not hand-edit installed copies; edit here and re-run `lazysitter update`.",
  "tiers": {
    "high": "Most capable model. Deep design, adversarial reasoning, intent judgement.",
    "high_alt": "A DISTINCT high-capability model from `high`, used for red-team so it does not share the implementers' / architect's blind spots. Falls back to `high` if unset.",
    "mid": "Balanced model. Most build and verification work.",
    "low": "Fast, cheap model. Mechanical scans and narrow classification."
  },
  "modelTierByLogical": {
    "opus": "high",
    "sonnet": "mid",
    "haiku": "low"
  },
  "neverSkip": [
    "lazysitter-spec-writer",
    "lazysitter-test-author",
    "lazysitter-test-runner",
    "lazysitter-code-reviewer",
    "lazysitter-security-expert",
    "lazysitter-security-auditor",
    "lazysitter-red-team",
    "lazysitter-devils-advocate",
    "lazysitter-secrets-scanner",
    "lazysitter-closing-loop-auditor",
    "lazysitter-reuse-auditor"
  ],
  "neverSkipModes": [
    { "agent": "lazysitter-red-team",    "mode": "plan-attack" },
    { "agent": "lazysitter-test-runner", "mode": "teeth-check" }
  ],
  "agents": {
    "lazysitter-recon":                { "tier": "low",  "codexSandbox": "workspace-write", "codexApproval": "never", "note": "Tier 0 mechanical capability probe; re-executes every run; CAPABILITIES.md is a drift-diff/audit record only, never gate authority (C3)." },
    "lazysitter-business-analyst":     { "tier": "mid",  "codexSandbox": "workspace-write", "codexApproval": "never", "note": "Writes ONLY its own REQUIREMENT.md to the run dir (self-persist); prompt-scoped, never edits source." },
    "lazysitter-triage":               { "tier": "mid",  "codexSandbox": "read-only",       "codexApproval": "never" },
    "lazysitter-explorer":             { "tier": "mid",  "codexSandbox": "workspace-write", "codexApproval": "never", "note": "Writes ONLY its own CONTEXT-PACK.md to the run dir (self-persist); prompt-scoped, never edits source. Bash grant is bound to the C5 probe allowlist and the explorer Bash denylist." },
    "lazysitter-spec-writer":          { "tier": "mid",  "codexSandbox": "workspace-write", "codexApproval": "never", "note": "Writes ONLY its own ACCEPTANCE-CRITERIA.md to the run dir (self-persist); prompt-scoped, never edits source." },
    "lazysitter-architect":            { "tier": "high", "codexSandbox": "workspace-write", "codexApproval": "never", "note": "Writes ONLY its own PLAN.md/DECISIONS.md/LIMITATIONS.md to the run dir (self-persist); prompt-scoped, never edits source." },
    "lazysitter-data-layer-expert":    { "tier": "mid",  "codexSandbox": "read-only",       "codexApproval": "never", "note": "Renamed from lazysitter-database-expert (C19/B11) — client-side stores (IndexedDB/localStorage/caches/socket-invalidation ordering) are in scope, not just a relational database. Two invocation modes in one role file: Tier-4 advisory, Tier-6 diff audit." },
    "lazysitter-infra-expert":         { "tier": "mid",  "codexSandbox": "read-only",       "codexApproval": "never" },
    "lazysitter-frontend-expert":      { "tier": "mid",  "codexSandbox": "read-only",       "codexApproval": "never" },
    "lazysitter-security-expert":      { "tier": "high", "codexSandbox": "read-only",       "codexApproval": "never" },
    "lazysitter-ux-analyst":           { "tier": "mid",  "codexSandbox": "read-only",       "codexApproval": "never" },
    "lazysitter-devils-advocate":      { "tier": "high", "codexSandbox": "workspace-write", "codexApproval": "never", "note": "Read-only-in-practice recon (Grep/Glob/Bash) to check a claim rather than argue it; never edits." },
    "lazysitter-backend-implementer":  { "tier": "mid",  "codexSandbox": "workspace-write", "codexApproval": "never" },
    "lazysitter-frontend-implementer": { "tier": "mid",  "codexSandbox": "workspace-write", "codexApproval": "never" },
    "lazysitter-dependency-auditor":   { "tier": "mid",  "codexSandbox": "workspace-write", "codexApproval": "never", "note": "No network granted (no enforcement point exists for a domain allowlist). Runs offline-only; reports cannot-verify-offline as a named degradation instead of a false-clean approve when a check needs live network." },
    "lazysitter-test-author":          { "tier": "mid",  "codexSandbox": "workspace-write", "codexApproval": "never", "note": "Writes tests only. Spawned in parallel with implementers so it is structurally blind to implementation." },
    "lazysitter-test-runner":          { "tier": "mid",  "codexSandbox": "workspace-write", "codexApproval": "never" },
    "lazysitter-code-reviewer":        { "tier": "mid",  "codexSandbox": "workspace-write", "codexApproval": "never" },
    "lazysitter-reuse-auditor":        { "tier": "mid",  "codexSandbox": "read-only",       "codexApproval": "never", "note": "Independent head on reuse-vs-create, outside the build lineage (B2). Read-only; skipped when the diff adds no new file/export/duplicating internal helper." },
    "lazysitter-red-team":             { "tier": "high", "codexSandbox": "workspace-write", "codexApproval": "never", "distinctModel": true, "note": "Uses the `high_alt` model slot to avoid shared blind spots with the build lineage." },
    "lazysitter-security-auditor":     { "tier": "high", "codexSandbox": "workspace-write", "codexApproval": "never" },
    "lazysitter-secrets-scanner":      { "tier": "low",  "codexSandbox": "read-only",       "codexApproval": "never" },
    "lazysitter-integration-checker":  { "tier": "mid",  "codexSandbox": "workspace-write", "codexApproval": "never" },
    "lazysitter-closing-loop-auditor": { "tier": "high", "codexSandbox": "read-only",       "codexApproval": "never" },
    "lazysitter-release-agent":        { "tier": "mid",  "codexSandbox": "workspace-write", "codexApproval": "on-request", "note": "Mutates git at the merge gate. Requires approval unless autoApproveGit is set." },
    "lazysitter-monitor-agent":        { "tier": "low",  "codexSandbox": "workspace-write", "codexApproval": "never" },
    "lazysitter-rollback-agent":       { "tier": "mid",  "codexSandbox": "workspace-write", "codexApproval": "on-request", "note": "Standing revert authority in the monitoring window. Mutates git." },
    "lazysitter-docs-agent":           { "tier": "low",  "codexSandbox": "workspace-write", "codexApproval": "never" }
  }
}
